{
  "packet_type": "local_gpu_triage_support_v0",
  "contract_version": "0.1.0",
  "pipeline_phase": "PHASE_B_MANUAL_GATE_PASSED_BOUNDED_RECEIPT",
  "ai_support_mode": "AI_SUPPORT_ONLY",
  "local_gpu_runtime_status": "PRIVATE_RUNTIME_SUPPORT_CONFIRMED",
  "local_gpu_runtime_label": "LOCAL_GPU_SUPPORT_NODE",
  "true_gpu_ci_status": "LOCAL_GPU_TRIAGE_GATE_GITHUB_ACTIONS_RUN_PASSED_WITH_PRIVATE_OPERATIONAL_METADATA",
  "human_review_required": true,
  "ai_decided_disposition": false,
  "recommended_disposition": null,
  "public_safe_status": "NOT_PUBLIC_SAFE",
  "public_proof_ceiling": "CONTROLLED_TEST_VALIDATED",
  "runtime_active_public_proof": false,
  "signal_observed_public_proof": false,
  "production_ready": false,
  "runtime_truth": {
    "runtime_support_class": "PRIVATE_RUNTIME_SUPPORT",
    "gpu_visible_private_support": true,
    "local_model_service_present": true,
    "runtime_refresh_required_for_new_claims": true,
    "public_runtime_claim_allowed": false
  },
  "model_support": {
    "local_model_available_private_support": true,
    "model_family": "local_ollama_qwen_support",
    "raw_model_output_included": false,
    "allowed_ai_actions": [
      "summarize",
      "list_uncertainty",
      "recommend_next_checks",
      "map_evidence_fields"
    ],
    "blocked_ai_actions": [
      "approve",
      "promote",
      "close",
      "decide_disposition",
      "mark_public_safe",
      "claim_compromise"
    ]
  },
  "github_ci_truth": {
    "self_hosted_runner_proven": true,
    "runner_labels_proven": true,
    "workflow_created": true,
    "workflow_run_id": "26006504673",
    "true_gpu_ci_status": "LOCAL_GPU_TRIAGE_GATE_GITHUB_ACTIONS_RUN_PASSED_WITH_PRIVATE_OPERATIONAL_METADATA",
    "model_execution_in_ci": false,
    "ollama_prompt_execution_in_ci": false
  },
  "privacy_boundary": {
    "real_host_identifier_included": false,
    "local_paths_included": false,
    "internal_ips_included": false,
    "secrets_included": false,
    "raw_model_output_included": false,
    "private_evidence_filenames_included": false
  },
  "blocked_claims": [
    "public-safe promotion",
    "runtime-active public proof",
    "signal-observed public proof",
    "production status",
    "fleet deployment",
    "autonomous operation",
    "AI-approved disposition",
    "analyst-approved disposition",
    "final disposition decision",
    "model execution in CI",
    "Ollama prompt execution in CI"
  ],
  "supported_claims": [
    "private local GPU support status can be reported with sanitized labels",
    "local model support remains advisory",
    "human review remains required",
    "manual GitHub Actions gate executed on the configured self-hosted GPU runner label route and passed deterministic contract/status/verifier checks"
  ],
  "does_not_prove": [
    "public-safe status",
    "runtime-active public proof",
    "signal-observed public proof",
    "production status",
    "fleet deployment",
    "autonomous operation",
    "AI or analyst disposition authority",
    "model execution in CI",
    "Ollama prompt execution in CI"
  ],
  "next_allowed_move": "HUMAN_REVIEW_BEFORE_ANY_MODEL_EXECUTION_OR_PROOF_PROMOTION",
  "stop_conditions": [
    "real host identifier would be needed",
    "local path or internal IP would be included",
    "model response body would be included",
    "workflow creation would be required",
    "runtime command execution would be required",
    "proof or public-safe promotion would be implied"
  ]
}
